company_cd,div_no,div_desc,cust_cd,delyloc_no,salesman_cd,salesman_name_e,salesman_email,delyloc_name_e,delyloc_name_c,delyloc_add1_e,delyloc_add2_e,delyloc_add3_e,delyloc_add1_c,delyloc_add2_c,delyloc_add3_c,tel,last_modify_date
AHKFSL,05,GOURMET FINE FOODS,F0011,000,601,MICHELLE CHENG,michelle.c@anglisscom.hk,ANGLISS MACAU FOOD SERVICE LTD,安得利澳門飲食服務有限公司,196-242 RUA DOS PESCADORES,EDF INDUSTRIAL OCEAN II FASE,4-ANDAR C & D  MACAU,澳門漁翁街１９６－２４２號,海洋工業中心第二期4樓C及D座,,9120 7061,2022-05-31 14:02
AHKFSL,05,GOURMET FINE FOODS,F19102,000,605,MOON TSEN,moon.t@angliss.com.hk,FOOD & ENVIRONMENTAL HYGIENE DEPARTMENT,FOOD & ENVIRONMENTAL HYGIENE DEPARTMENT,416A  SOUTH OFFICE BLOCK  HAECO,SUPER TERMINAL ONE,LANTAU  NT,新界大嶼山國際機場,超級一號貨站辦公大樓南座416A,,2116 8251,2011-05-03 17:10
AHKFSL,11,ITALIAN FOODS,K00002,000,110,UGO PIETROLUONGO,ugo.p@angliss.com.hk,PASTRYGLOBAL FOOD SERVICE LTD (FOODTALK) 000,嘉寶食品有限公司 (FOODTALK),47-51 KWAI FUNG CRESCENT,KWAI CHUNG,NT,新界葵涌葵豐街47-51號,,,2494 2908,2022-05-31 14:02
AHKFSL,11,ITALIAN FOODS,K00002,001,110,UGO PIETROLUONGO,ugo.p@angliss.com.hk,PASTRYGLOBAL FOOD SERVICE LTD (FOODTALK 2) 001,嘉寶食品有限公司 (FOODTALK2),FLAT J  G/F & FLAT ROOF  HING YIP BLDG,5-23 FIRST ST,HK,香港西營盤第1街5-23號地下J舖,,,,2022-05-31 14:02
AHKFSL,11,ITALIAN FOODS,K00028,000,110,UGO PIETROLUONGO,ugo.p@angliss.com.hk,GOURMET CUISINE HONG KONG LIMITED,高美食材香港有限公司,47-51 KWAI FUNG CRESCENT,KWAI CHUNG,NT,新界葵涌葵豐街47-51號,,,2494 1988,2022-05-31 14:04
AHKFSL,11,ITALIAN FOODS,K00029,000,110,UGO PIETROLUONGO,ugo.p@angliss.com.hk,SAMPLE ACCOUNT - ITALIAN FOODS,SAMPLE ACCOUNT - ITALIAN FOODS,H K,,,H K,,,,2013-12-06 16:36
AHKFSL,11,ITALIAN FOODS,K00031,000,110,UGO PIETROLUONGO,ugo.p@angliss.com.hk,ANGLISS MACAU FOOD SERVICE LTD,安得利澳門飲食服務有限公司,196-242 RUA DOS PESCADORES,EDF INDUSTRIAL OCEAN II FASE,4-ANDAR C & D  MACAU,澳門漁翁街１９６－２４２號,海洋工業中心第二期4樓C及D座,,9120 7061,2022-05-31 14:04